{
  "meta": {
    "reviewDate": "2026-02-12",
    "reviewId": "REV-20260212-001",
    "transaction": {
      "summary": "AB1-CAR 시작금형제작/수리 매매계약",
      "buyer": "한길산업 주식회사",
      "supplier": "대성테크",
      "totalAmount": 59000000
    }
  },
  "documents": [
    {
      "docId": "06fc682a",
      "docType": "사업자등록증",
      "party": "갑",
      "status": "pass",
      "extractedData": {
        "businessRegNo": "123-45-67890",
        "companyName": "한길산업 주식회사",
        "representative": "홍길동",
        "address": "경상북도 경주시 ○○읍 ○○산단길 58",
        "supplyAmount": null,
        "taxAmount": null,
        "totalAmount": null,
        "date": "2023-10-06",
        "bankName": null,
        "accountNo": null,
        "accountHolder": null,
        "items": ""
      },
      "checklist": [
        { "item": "등록번호(10자리)", "status": "pass", "value": "123-45-67890" },
        { "item": "상호", "status": "pass", "value": "한길산업 주식회사" },
        { "item": "대표자", "status": "pass", "value": "홍길동" },
        { "item": "개업년월일", "status": "pass", "value": "2014-01-08" },
        { "item": "소재지", "status": "pass", "value": "경상북도 경주시 ○○읍 ○○산단길 58" },
        { "item": "업태", "status": "pass", "value": "제조업, 도매 및 소매업" },
        { "item": "종목", "status": "pass", "value": "자동차부품, 합성수지 등" }
      ]
    },
    {
      "docId": "1f7da885",
      "docType": "통장사본",
      "party": "갑",
      "status": "warning",
      "extractedData": {
        "businessRegNo": "",
        "companyName": "한길산업 주식회사",
        "representative": "",
        "address": "",
        "supplyAmount": null,
        "taxAmount": null,
        "totalAmount": null,
        "date": "2017-04-14",
        "bankName": "IBK기업은행",
        "accountNo": "01-012345-01-010",
        "accountHolder": "한길산업 주식회사(추정)",
        "items": ""
      },
      "checklist": [
        { "item": "은행명", "status": "pass", "value": "IBK기업은행" },
        { "item": "계좌번호", "status": "pass", "value": "01-012345-01-010" },
        { "item": "예금주명", "status": "warning", "note": "이미지에서 명확히 확인 불가" },
        { "item": "계좌종류", "status": "warning", "note": "미확인" }
      ]
    },
    {
      "docId": "b238f9a6",
      "docType": "견적서",
      "party": "을",
      "status": "warning",
      "extractedData": {
        "businessRegNo": "",
        "companyName": "대성테크",
        "representative": "김철수",
        "address": "경상북도 경주시 ○○읍 ○○산단로 69-12",
        "supplyAmount": 59000000,
        "taxAmount": null,
        "totalAmount": 67255019,
        "date": "2025-07-01",
        "bankName": null,
        "accountNo": null,
        "accountHolder": null,
        "items": "88PT5-DCL10 REINF TAILGATE LWR INR 금형(21,352,996) + AB1 중소물 압착설비(45,902,023)"
      },
      "checklist": [
        { "item": "견적업체정보", "status": "pass", "value": "대성테크 / 김철수" },
        { "item": "수신처", "status": "pass", "value": "한길산업" },
        { "item": "견적일자", "status": "pass", "value": "2025-07-01" },
        { "item": "품목내역", "status": "pass", "value": "금형 1벌 + 설비 1대" },
        { "item": "합계금액", "status": "pass", "value": "견적가 67,255,019 / 실행가 59,000,000", "note": "견적가·실행가 구분 정상" },
        { "item": "사업자등록번호", "status": "fail", "note": "미기재" }
      ]
    },
    {
      "docId": "1164aeb6",
      "docType": "계약서",
      "party": "공통",
      "status": "pass",
      "extractedData": {
        "businessRegNo": "123-45-67890 / 987-65-43210",
        "companyName": "한길산업(주) / 대성테크",
        "representative": "홍길동 / 김철수",
        "address": "경주시 ○○읍 ○○산단길 58 / 경주시 ○○읍 ○○산단로 69-12",
        "supplyAmount": 59000000,
        "taxAmount": null,
        "totalAmount": 59000000,
        "date": "2025-08-12",
        "bankName": null,
        "accountNo": null,
        "accountHolder": null,
        "items": "AB1 금형 19,000,000 + AB1 설비 40,000,000 = 59,000,000 (부가세별도)"
      },
      "checklist": [
        { "item": "갑 당사자 정보", "status": "pass", "value": "한길산업(주) / 홍길동" },
        { "item": "을 당사자 정보", "status": "pass", "value": "대성테크 / 김철수 / 987-65-43210" },
        { "item": "계약목적", "status": "pass", "value": "AB1-CAR 시작금형제작/수리 매매" },
        { "item": "계약금액", "status": "pass", "value": "59,000,000원" },
        { "item": "계약기간", "status": "pass" },
        { "item": "대금지급조건", "status": "pass", "value": "금형비 100% 선급, 설비비 30/50/20" },
        { "item": "계약일", "status": "pass", "value": "2025-08-12" },
        { "item": "서명/날인", "status": "pass" }
      ]
    },
    {
      "docId": "736f7a18",
      "docType": "거래명세서",
      "party": "공통",
      "status": "fail",
      "extractedData": {
        "businessRegNo": "987-65-43210 / 111-22-33444",
        "companyName": "대성테크 / 한길산업",
        "representative": "김철수 / 홍길동",
        "address": "경주시 ○○읍 ○○산단로 15 / ○○시 ○○구 ○○길 87-10",
        "supplyAmount": null,
        "taxAmount": null,
        "totalAmount": null,
        "date": "2025-09-30",
        "bankName": null,
        "accountNo": null,
        "accountHolder": null,
        "items": "AB1 REINF TAILGATE LWR INR (88PT5-DCL10) MOULD × 1"
      },
      "checklist": [
        { "item": "공급자 정보", "status": "pass", "value": "대성테크 / 987-65-43210" },
        { "item": "공급받는자 정보", "status": "pass", "value": "한길산업 / 111-22-33444" },
        { "item": "작성일자", "status": "pass", "value": "2025-09-30 (필기)" },
        { "item": "품목내역", "status": "pass" },
        { "item": "공급가액", "status": "fail", "note": "미기재 (공란)" },
        { "item": "세액", "status": "fail", "note": "미기재 (공란)" },
        { "item": "합계금액", "status": "fail", "note": "미기재 (공란)" }
      ]
    },
    {
      "docId": "9610af16",
      "docType": "세금계산서",
      "party": "공통",
      "status": "pass",
      "extractedData": {
        "businessRegNo": "987-65-43210 / 123-45-67890",
        "companyName": "대성테크 / 한길산업(주)",
        "representative": "김철수 / 홍길동",
        "address": "경주시 ○○읍 ○○산단로 69-12 / 경주시 ○○읍 ○○산단로4길 45",
        "supplyAmount": 19000000,
        "taxAmount": 1900000,
        "totalAmount": 20900000,
        "date": "2025-08-14",
        "bankName": null,
        "accountNo": null,
        "accountHolder": null,
        "items": "AB1 REINF-TAILGATE LWR INR#시작금형"
      },
      "checklist": [
        { "item": "공급자 사업자등록번호", "status": "pass", "value": "987-65-43210" },
        { "item": "공급자 상호/대표자", "status": "pass", "value": "대성테크 / 김철수" },
        { "item": "공급받는자 사업자등록번호", "status": "pass", "value": "123-45-67890" },
        { "item": "공급가액", "status": "pass", "value": "19,000,000" },
        { "item": "세액(공급가액×10%)", "status": "pass", "value": "1,900,000" },
        { "item": "작성일자", "status": "pass", "value": "2025-08-14" },
        { "item": "품목", "status": "pass" },
        { "item": "승인번호", "status": "pass", "value": "20250814-10250814-00000000" }
      ]
    },
    {
      "docId": "e86a067f",
      "docType": "검수조서",
      "party": "공통",
      "status": "pass",
      "extractedData": {
        "businessRegNo": "987-65-43210",
        "companyName": "한길산업(주)",
        "representative": "",
        "address": "",
        "supplyAmount": 19000000,
        "taxAmount": null,
        "totalAmount": 19000000,
        "date": "2025-09-30",
        "bankName": null,
        "accountNo": null,
        "accountHolder": null,
        "items": "외주용역비 - 시금형 외주 가공비"
      },
      "checklist": [
        { "item": "검수대상", "status": "pass", "value": "AB1-CAR REINF TAILGATE LWR INR 시작금형" },
        { "item": "검수일자", "status": "pass", "value": "2025-09-30" },
        { "item": "공급자정보", "status": "pass", "value": "대성테크 / 987-65-43210" },
        { "item": "검수자서명", "status": "pass", "value": "이영희" },
        { "item": "금액", "status": "pass", "value": "19,000,000" },
        { "item": "검수사진", "status": "pass", "note": "첨부 확인됨 (page-2)" },
        { "item": "검수결과 명시", "status": "warning", "note": "합격/불합격 명시적 표시 없음" }
      ]
    },
    {
      "docId": "c5d81eba",
      "docType": "이체확인증",
      "party": "갑",
      "status": "pass",
      "extractedData": {
        "businessRegNo": "",
        "companyName": "한길산업 주식회사",
        "representative": "",
        "address": "",
        "supplyAmount": null,
        "taxAmount": null,
        "totalAmount": 20900000,
        "date": "2025-08-14",
        "bankName": "IBK기업은행",
        "accountNo": "601-012345-01-010",
        "accountHolder": "한길산업 주식회사",
        "items": ""
      },
      "checklist": [
        { "item": "이체일자", "status": "pass", "value": "2025-08-14 10:54:12" },
        { "item": "출금계좌", "status": "pass", "value": "IBK기업은행 601-012345-01-010" },
        { "item": "입금계좌", "status": "pass", "value": "부산은행 1012345678901 / 대성테크 김철수" },
        { "item": "이체금액", "status": "pass", "value": "20,900,000" },
        { "item": "거래고유번호", "status": "pass", "value": "003EI00000000" }
      ]
    },
    {
      "docId": "37a4f6c6",
      "docType": "사업자등록증",
      "party": "을",
      "status": "pass",
      "extractedData": {
        "businessRegNo": "987-65-43210",
        "companyName": "대성테크",
        "representative": "김철수",
        "address": "경상북도 경주시 ○○읍 ○○산단로 69-12",
        "supplyAmount": null,
        "taxAmount": null,
        "totalAmount": null,
        "date": "2020-10-19",
        "bankName": null,
        "accountNo": null,
        "accountHolder": null,
        "items": ""
      },
      "checklist": [
        { "item": "등록번호(10자리)", "status": "pass", "value": "987-65-43210" },
        { "item": "상호", "status": "pass", "value": "대성테크" },
        { "item": "대표자", "status": "pass", "value": "김철수" },
        { "item": "개업년월일", "status": "pass", "value": "2018-07-02" },
        { "item": "소재지", "status": "pass", "value": "경상북도 경주시 ○○읍 ○○산단로 69-12" },
        { "item": "업태", "status": "pass", "value": "제조업/도매업" },
        { "item": "종목", "status": "pass", "value": "선박부품/자동차 지그·조립/상품중개" }
      ]
    },
    {
      "docId": "5aaf66ff",
      "docType": "통장사본",
      "party": "을",
      "status": "pass",
      "extractedData": {
        "businessRegNo": "",
        "companyName": "대성테크",
        "representative": "김철수",